DB Term	Display Name	Description	Same As	Source
1_basic_principles_observed	1 - Basic principles observed	Fundamental scientific principles have been identified, but no practical applications have been identified yet.		https://en.wikipedia.org/wiki/Technology_readiness_level
2_concept_formulated_planning	2 - Concept formulated (planning)	The service concept is established, and initial feasibility studies have been conducted.		https://en.wikipedia.org/wiki/Technology_readiness_level
3_experimental_proof_of_concept	3 - Experimental proof of concept	The service has been demonstrated in a laboratory setting, and initial experimental testing has been completed.		https://en.wikipedia.org/wiki/Technology_readiness_level
4_concept_validated_in_controlled_environment	4 - Concept validated in controlled environment	The service has been validated in a controlled environment and shown to work as intended.		https://en.wikipedia.org/wiki/Technology_readiness_level
5_service_validated_in_hs_environment_alpha	5 - Service validated in HS environment (alpha)	The service has been validated in a Heritage Science environment and shown to work as intended. (For software this would count as an initial functioning version)		https://en.wikipedia.org/wiki/Technology_readiness_level
6_service_demonstrated_in_hs_environment	6 - Service demonstrated in HS environment	The service has been demonstrated in a Heritage Science environment and proven to be effective in meeting its objectives.		https://en.wikipedia.org/wiki/Technology_readiness_level
7_operational service prototype_demonstrated_beta	7 - Operational service prototype demonstrated (beta)	A functional prototype of the service has been demonstrated in an operational environment. (For software this would count as a close to fully functioning test version)		https://en.wikipedia.org/wiki/Technology_readiness_level
8_service_complete_and_qualified_release_candidate	8 - Service complete and qualified (release candidate)	The service has been completed and qualified through test and demonstration, and is ready for production. (For software this would count as a version ready for release at the very final stages of testing)		https://en.wikipedia.org/wiki/Technology_readiness_level
9_service_proven_in_operational_environment_production	9 - Service proven in operational environment (production)	The service has been successfully deployed and proven to be effective in a Heritage Science environment and has been exploited for successful Accesses.		https://en.wikipedia.org/wiki/Technology_readiness_level
